{
  "$schema":"https://json-schema.org/draft/2020-12/schema","$id":"https://warden-drydock.invalid/contracts/hosted/v1/atlas.schema.json","title":"Campaign Atlas view models v1",
  "$defs":{"id":{"type":"string","minLength":3,"maxLength":80,"pattern":"^[a-z][a-z0-9]*(?:_[a-z0-9]+)*$"},"authority":{"enum":["preparation","canon","revealed"]},"entity":{"type":"object","required":["entity_id","entity_type","name","authority"],"additionalProperties":false,"properties":{"entity_id":{"$ref":"#/$defs/id"},"entity_type":{"$ref":"#/$defs/id"},"name":{"type":"string","minLength":1,"maxLength":160},"authority":{"$ref":"#/$defs/authority"}}},"connection":{"type":"object","required":["connection_id","from_entity_id","to_entity_id","label","direction"],"additionalProperties":false,"properties":{"connection_id":{"$ref":"#/$defs/id"},"from_entity_id":{"$ref":"#/$defs/id"},"to_entity_id":{"$ref":"#/$defs/id"},"label":{"type":"string","minLength":1,"maxLength":120},"direction":{"enum":["directed","undirected"]}}}},
  "type":"object","required":["contract_name","contract_version","campaign","viewed_revision","head_revision","entities","connections","backlinks","history","comparison"],"additionalProperties":false,
  "properties":{"contract_name":{"const":"campaign_atlas"},"contract_version":{"const":1},"campaign":{"type":"object","required":["campaign_id","name","adapter_id"],"additionalProperties":false,"properties":{"campaign_id":{"$ref":"#/$defs/id"},"name":{"type":"string","minLength":1,"maxLength":160},"adapter_id":{"const":"mothership"}}},"viewed_revision":{"type":"object","required":["revision_id","ordinal","tree_digest"],"additionalProperties":false,"properties":{"revision_id":{"$ref":"#/$defs/id"},"ordinal":{"type":"integer","minimum":1},"tree_digest":{"type":"string","pattern":"^[a-f0-9]{64}$"}}},"head_revision":{"$ref":"#/$defs/id"},"entities":{"type":"array","items":{"$ref":"#/$defs/entity"},"uniqueItems":true},"connections":{"type":"array","items":{"$ref":"#/$defs/connection"},"uniqueItems":true},"backlinks":{"type":"array","items":{"type":"object","required":["source_entity_id","target_entity_id","connection_id"],"additionalProperties":false,"properties":{"source_entity_id":{"$ref":"#/$defs/id"},"target_entity_id":{"$ref":"#/$defs/id"},"connection_id":{"$ref":"#/$defs/id"}}}},"history":{"type":"array","items":{"type":"object","required":["event_id","revision_id","authority","title"],"additionalProperties":false,"properties":{"event_id":{"$ref":"#/$defs/id"},"revision_id":{"$ref":"#/$defs/id"},"authority":{"$ref":"#/$defs/authority"},"title":{"type":"string","minLength":1,"maxLength":160}}}},"comparison":{"type":"object","required":["from_revision","to_revision","changes"],"additionalProperties":false,"properties":{"from_revision":{"$ref":"#/$defs/id"},"to_revision":{"$ref":"#/$defs/id"},"changes":{"type":"array","items":{"type":"object","required":["subject_id","change_type"],"additionalProperties":false,"properties":{"subject_id":{"$ref":"#/$defs/id"},"change_type":{"enum":["added","removed","changed","authority_changed"]}}}}}}}
}
